{
  "$schema": "https://json-schema.org/draft/2020-12/schema",
  "$id": "https://github.com/agentpatternscatalog/patterns/recipes.schema.json",
  "title": "Pattern Recipes",
  "description": "Named cross-category compositions of patterns. Each recipe lists pattern ids that together form a recognisable kind of system. Pattern ids must resolve to entries in patterns-src/.",
  "type": "object",
  "additionalProperties": false,
  "required": ["last_analysis_date", "recipes"],
  "properties": {
    "$schema": {"type": "string"},
    "title": {"type": "string"},
    "description": {"type": "string"},
    "last_analysis_date": {"type": "string", "format": "date"},
    "roles": {
      "type": "object",
      "description": "Documentation of allowed member roles."
    },
    "recipes": {
      "type": "array",
      "items": {"$ref": "#/$defs/recipe"}
    }
  },
  "$defs": {
    "recipe": {
      "type": "object",
      "additionalProperties": false,
      "required": ["id", "name", "description", "members"],
      "properties": {
        "id": {
          "type": "string",
          "pattern": "^[a-z0-9][a-z0-9-]*$"
        },
        "name": {"type": "string"},
        "description": {"type": "string"},
        "members": {
          "type": "array",
          "minItems": 2,
          "items": {
            "type": "object",
            "additionalProperties": false,
            "required": ["pattern", "role"],
            "properties": {
              "pattern": {
                "type": "string",
                "pattern": "^[a-z0-9][a-z0-9-]*$",
                "description": "Pattern id from patterns-src/."
              },
              "role": {
                "type": "string",
                "enum": ["core", "hardening", "optional"]
              },
              "note": {"type": "string"}
            }
          }
        }
      }
    }
  }
}
